{
  "hero": {
    "name": "Manoj Kumar",
    "headline": "Professor of Practice | Artificial Intelligence, Analytics and Engineering Management",
    "summary": "Industry and academic professional with extensive experience across analytics, artificial intelligence, digital transformation, operations and management education. Develops practice-oriented graduate and postgraduate courses, case studies, capstone projects and executive learning programmes that connect theory with real organisational decisions.",
    "photo": "",
    "photoAlt": "Portrait of Manoj Kumar",
    "contact": {
      "location": "India",
      "email": "iManoj.Kumar@hotmail.com",
      "phone": "+91-9313449849",
      "officeHours": "10AM-5PM IST, Monday to Friday"
    },
    "cvUrl": ""
  },

  "social": [
    { "label": "GitHub", "icon": "github", "url": "https://github.com/imanojkumar", "status": "published" },
    { "label": "Google Scholar", "icon": "google-scholar", "url": "https://scholar.google.com/citations?user=3t83VSUAAAAJ", "status": "published" },
    { "label": "ORCID", "icon": "orcid", "url": "https://orcid.org/0000-0001-8988-038X", "status": "published" },
    { "label": "ResearchGate", "icon": "researchgate", "url": "https://www.researchgate.net/profile/Manoj_Kumar458/stats", "status": "published" },
    { "label": "LinkedIn", "icon": "linkedin", "url": "https://www.linkedin.com/in/imanojkumar/", "status": "published" },
    { "label": "Stack Overflow", "icon": "stackoverflow", "url": "https://stackoverflow.com/users/4026992/manoj-kumar?tab=badges", "status": "published" },
    { "label": "Blog", "icon": "blog", "url": "", "status": "draft" }
  ],

  "focus": {
    "professional": {
      "title": "Professional focus",
      "icon": "target",
      "items": [
        "Artificial Intelligence for Business",
        "Business Analytics",
        "Engineering Management",
        "Digital Transformation",
        "Operations and Supply Chain",
        "Mining and Natural Resources"
      ]
    },
    "teaching": {
      "title": "Teaching focus",
      "icon": "book",
      "items": [
        "Graduate courses",
        "Postgraduate courses",
        "Executive education",
        "Faculty development programmes",
        "Industrial training",
        "Case-based learning",
        "Capstone supervision"
      ]
    },
    "industry": {
      "title": "Industry experience",
      "icon": "briefcase",
      "description": "Experience spanning industry practice and academic teaching across analytics, artificial intelligence, operations and digital transformation.",
      "years": ""
    },
    "expertise": {
      "title": "Key expertise",
      "icon": "bulb",
      "items": [
        "Artificial Intelligence and Machine Learning",
        "Business Analytics",
        "Operations and Supply Chain Analytics",
        "Digital Transformation",
        "Data-Driven Decision Making"
      ]
    }
  },

  "education": [
    { "status": "published", "qualification": "DBA", "discipline": "Business Administration", "institution": "EIASM", "country": "Czech Republic", "year": "2024", "distinction": "" },
    { "status": "published", "qualification": "PG Diploma", "discipline": "AI & ML", "institution": "IIIT Bangalore", "country": "India", "year": "2021", "distinction": "" },
    { "status": "published", "qualification": "MBA", "discipline": "Business Administration", "institution": "[Institution]", "country": "India", "year": "2009", "distinction": "" },
    { "status": "published", "qualification": "B.Tech.", "discipline": "Mining & Machinery Engineering", "institution": "IIT-ISM Dhanbad", "country": "India", "year": "2001", "distinction": "" }
  ],

  "books": [
    { "status": "published", "title": "[Book title]", "subtitle": "[Subtitle]", "publisher": "[Publisher]", "year": "[Year]", "isbn": "[ISBN]", "cover": "", "description": "[One or two sentences describing the book.]", "viewUrl": "", "detailsUrl": "" },
    { "status": "published", "title": "[Book title]", "subtitle": "[Subtitle]", "publisher": "[Publisher]", "year": "[Year]", "isbn": "[ISBN]", "cover": "", "description": "[One or two sentences describing the book.]", "viewUrl": "", "detailsUrl": "" },
    { "status": "published", "title": "[Book title]", "subtitle": "[Subtitle]", "publisher": "[Publisher]", "year": "[Year]", "isbn": "[ISBN]", "cover": "", "description": "[One or two sentences describing the book.]", "viewUrl": "", "detailsUrl": "" }
  ],

  "software": {
    "python": [
      { "status": "published", "name": "MineProductivity", "description": "scikit-learn for mining productivity.", "version": "[Version]", "pypiUrl": "https://pypi.org/project/mineproductivity/", "githubUrl": "https://github.com/imanojkumar/MineProductivity", "docsUrl": "https://imanojkumar.github.io/MineProductivity/" }
    ],
    "r": [
      { "status": "published", "name": "MiningCostBench", "description": "Cost-driver benchmarking across 53 commodities. 6 categories, with 6-stage cost decomposition.", "cranUrl": "", "githubUrl": "https://github.com/imanojkumar/MiningCostBench", "docsUrl": "https://imanojkumar.github.io/MiningCostBench/" },
      { "status": "published", "name": "MineSDG", "description": "Strategic Analytics & Sector Intelligence", "cranUrl": "", "githubUrl": "https://github.com/imanojkumar/MineSDG", "docsUrl": "https://imanojkumar.github.io/MineSDG/" },
      { "status": "published", "name": "haulplan", "description": "Truck-shovel fleet deployment engine with a finite-source queue/bunching model and an interactive Shiny dashboard for haulage planning.", "cranUrl": "", "githubUrl": "https://github.com/imanojkumar/haulplan", "docsUrl": "https://imanojkumar.github.io/haulplan/" }
    ],
    "other": [
      { "status": "draft", "name": "[Project or tool name]", "description": "[Short description.]", "kind": "[web app / analytics tool / educational utility]", "url": "", "githubUrl": "" }
    ]
  },

  "consulting": [
    { "status": "draft", "title": "[Engagement title]", "organisation": "[Organisation]", "audience": "[Audience]", "location": "[Location]", "year": "[Year]", "duration": "[Duration]", "description": "[Short description of the engagement.]", "tags": ["[Topic]", "[Topic]"] }
  ],

  "conferences": [
    { "status": "draft", "name": "[Conference name]", "role": "[Role, e.g. Presenter]", "location": "[Location]", "date": "[Date]", "topic": "[Paper or topic]", "url": "" }
  ],

  "talks": [
    { "status": "draft", "title": "[Talk title]", "organisation": "[Institution or organisation]", "audience": "[Audience]", "year": "[Year]", "topic": "[Topic]", "url": "" }
  ],

  "accolades": [
    { "status": "draft", "title": "[Recognition or role]", "detail": "[Context, e.g. keynote, panel member, reviewer recognition]", "year": "[Year]" }
  ],

  "service": [
    { "status": "draft", "category": "[e.g. Journal reviewing]", "detail": "[Journal or organisation]" }
  ],

  "memberships": [
    { "status": "draft", "organisation": "[Professional body]", "role": "[Member / Fellow / etc.]", "since": "[Year]" }
  ],

  "stats": [
    { "status": "draft", "value": "[Number]", "label": "professional programmes delivered" },
    { "status": "draft", "value": "[Number]", "label": "journal articles reviewed" }
  ],

  "researchInterests": [
    "Responsible AI",
    "Business Analytics",
    "Agentic AI",
    "Digital Transformation",
    "AI in Operations",
    "AI in Manufacturing",
    "Sustainability",
    "Engineering Management"
  ],

  "teachingInterests": [
    "Business Analytics",
    "Business Science",
    "AI for Business",
    "Agentic AI in Supply Chain",
    "AI for Manufacturing Engineering",
    "Data-Driven Decision Making",
    "Operations Analytics",
    "Digital Transformation for Managers"
  ]
}
